回数,賞,ID,song_by,歌詞
36,新人賞,1232,海峡恋歌_by_西尾夕紀,海を渡った あのひとに 心あずけた 恋ひとつ 背伸びしたって 遠い人 知っていながら 抱かれたの 離れたくない あなたのそばを 世間知らずと 言われても 恋しくて ああ 恋しくて ああ 胸まで 痛みます 小雪ちらつく 海峡は 未練ごころを 凍らせる 熱い涙で 溶かしても 波がふたりを 引き離す 私ひとりで 生きられますか 強いおんなに なれますか 恋しくて ああ 恋しくて ああ 胸まで 痛みます あなた忘れて 生きるには 辛い旅です 別離(わかれ)です いくつ季節が 変ったら めぐり逢えるの 幸せに 燃えて焦がれて 思いを尽し 愛に泣くなら それもいい 恋しくて ああ 恋しくて ああ 胸まで 痛みます
36,最優秀新人賞,1232,海峡恋歌_by_西尾夕紀,海を渡った あのひとに 心あずけた 恋ひとつ 背伸びしたって 遠い人 知っていながら 抱かれたの 離れたくない あなたのそばを 世間知らずと 言われても 恋しくて ああ 恋しくて ああ 胸まで 痛みます 小雪ちらつく 海峡は 未練ごころを 凍らせる 熱い涙で 溶かしても 波がふたりを 引き離す 私ひとりで 生きられますか 強いおんなに なれますか 恋しくて ああ 恋しくて ああ 胸まで 痛みます あなた忘れて 生きるには 辛い旅です 別離(わかれ)です いくつ季節が 変ったら めぐり逢えるの 幸せに 燃えて焦がれて 思いを尽し 愛に泣くなら それもいい 恋しくて ああ 恋しくて ああ 胸まで 痛みます
36,新人賞,5155,憧夢 ～風に向かって～_by_Be-B,いつだって 忘れない言葉がある いつだって 信じている願いがある 遠くで輝いて 導くダイヤモンドのきらめき I WON'T NEVER 胸の奥 悔しくて 眠れない夜 思い出すよ大好きな あの人を どこにいても 少しめげそうな日には 顔を上げてゆく 風に向かってゆこう ひとつだけ 届けたい言葉がある ひとつだけ 大切な思いがある 夢見る力には 涙をこえる翼があるのさ I WAN'T TO BE いつの日か 憧れを形にして 思い出すよ こんな日を 少しだけ 笑いながら 少しめげそうな日には 顔を上げてゆく 風に向かってゆこう I WON'T NEVER 胸の奥 悔しくて 眠れない夜 思い出すよ大好きな あの人を どこにいても 少しめげそうな日には 顔を上げてゆく 風に向かってゆこう
36,新人賞,6657,土佐のおんな節_by_水田竜子,かけた命はエー 一本道だ 脇見している 暇はない 男まさりの 黒潮育ち 涙こぼせば 汚点になる アアンアン… 土佐のおんなはヨー 炎のおんな 惚れた二人はエー 番いの舟だ 夢が呼んでる 桂浜 高い波ほど 谷間も深い 陰で私が 舵をとる アアンアン… 土佐のおんなはヨー 深なさけ 生きるこの世がエー 筋書き無しの たった一度の 舞台なら かぶる苦労を はねのけながら 耐えてひと花 咲かせたい アアンアン… 土佐のおんなはヨー 夢おんな
36,最優秀歌唱賞,39643,逢えるじゃないかまたあした_by_石原裕次郎・川中美幸,夜風が二人を のぞいて行った 道の枯葉が 遠くで泣いた 「行かないで まだ行かないで」 あの娘の瞳も 泣いている並木道 「泣かないで 涙をおふき 逢えるじゃないか またあした」 夜更けの街角 二人のものさ 淡い灯影が 舗道を濡らす 「嬉しいの やさしく抱いて」 はじらうあの娘の 愛しいうしろかげ 「嬉しいさ この僕だって 逢えるじゃないか またあした」 眸(め)と眸(め)でささやく 二人のこころ なにもいわずに 歩いていたい 「帰らない 貴方(あなた)といたい」 甘えるそぶりが なんとなくかわいいぜ 「帰ろうよ 灯りも消えた 逢えるじゃないか またあした」
36,レコード大賞,7632,innocent world_by_Mr.Children,黄昏の街を背に 抱き合えたあの頃が 胸をかすめる 軽はずみな言葉が 時に人を傷つけた そして君は居ないよ 窓に反射する(うつる) 哀れな自分(おとこ)が 愛(いとお)しくもある この頃では Ah 僕は僕のままで ゆずれぬ夢を抱えて どこまでも歩き続けて行くよ いいだろう？ mr. myself いつの日も この胸に流れてる メロディー 軽やかに 緩やかに 心を伝うよ 陽のあたる坂道を昇る その前に また何処かで 会えるといいな イノセント ワールド 近頃じゃ夕食の 話題でさえ仕事に 汚染(よご)されていて 様々な角度から 物事を見ていたら 自分を見失ってた 入り組んでいる 関係の中で いつも帳尻 合わせるけど Ah 君は君のままに 静かな暮らしの中で 時には風に身を任せるのも いいじゃない oh miss yourself 物憂げな 6月の雨に 打たれて 愛に満ちた 季節を想って 歌うよ 知らぬ間に忘れてた 笑顔など見せて 虹の彼方へ放つのさ 揺れる想いを 変わり続ける 街の片隅で 夢の破片(かけら)が 生まれてくる Oh 今にも そして僕はこのままで 微かな光を胸に 明日も進んで行くつもりだよ いいだろう？ mr. myself いつの日も この胸に流れてる メロディー 切なくて 優しくて 心が痛いよ 陽のあたる坂道を昇る その前に また何処かで 会えるといいな その時は笑って 虹の彼方へ放つのさ イノセント ワールド 果てしなく続く イノセント ワールド
36,優秀賞,7632,innocent world_by_Mr.Children,黄昏の街を背に 抱き合えたあの頃が 胸をかすめる 軽はずみな言葉が 時に人を傷つけた そして君は居ないよ 窓に反射する(うつる) 哀れな自分(おとこ)が 愛(いとお)しくもある この頃では Ah 僕は僕のままで ゆずれぬ夢を抱えて どこまでも歩き続けて行くよ いいだろう？ mr. myself いつの日も この胸に流れてる メロディー 軽やかに 緩やかに 心を伝うよ 陽のあたる坂道を昇る その前に また何処かで 会えるといいな イノセント ワールド 近頃じゃ夕食の 話題でさえ仕事に 汚染(よご)されていて 様々な角度から 物事を見ていたら 自分を見失ってた 入り組んでいる 関係の中で いつも帳尻 合わせるけど Ah 君は君のままに 静かな暮らしの中で 時には風に身を任せるのも いいじゃない oh miss yourself 物憂げな 6月の雨に 打たれて 愛に満ちた 季節を想って 歌うよ 知らぬ間に忘れてた 笑顔など見せて 虹の彼方へ放つのさ 揺れる想いを 変わり続ける 街の片隅で 夢の破片(かけら)が 生まれてくる Oh 今にも そして僕はこのままで 微かな光を胸に 明日も進んで行くつもりだよ いいだろう？ mr. myself いつの日も この胸に流れてる メロディー 切なくて 優しくて 心が痛いよ 陽のあたる坂道を昇る その前に また何処かで 会えるといいな その時は笑って 虹の彼方へ放つのさ イノセント ワールド 果てしなく続く イノセント ワールド
36,ミュージックビデオ賞,5327,ROSIER_by_LUNA SEA,"輝く事さえ忘れた街は ネオンの洪水 夢遊病の群れ 腐った野望の吹き溜まりの中 見上げた夜空を切り刻んでいたビル 夢のない この世界 輝く星さえ見えない都会で 夜空に終りを探し求めて この夜にかざした細い指先 答えを探し求めている 揺れて揺れて今心が 何も信じられないまま 咲いていたのは my rosy heart 揺れて揺れてこの世界で 愛することも出来ぬまま 哀しい程 鮮やかな 花弁の様に ROSIER 愛したキミには ROSIER 近づけない ROSIER 抱き締められない ROSIER 愛しすぎて I've pricked my heart. By the time I knew. I was born Reason or quest, not being told What do I do. What should I take Words “God Only Knows” won't work for me Nothing starts Nothing ends in this city Exists only sever lonesome and cruel reality But still search for light I am the trigger, I choose my final way Whether I bloom or fall, is up to me I am the trigger. 揺れて揺れて今心が 何も信じられないまま 咲いていたのは my rosy heart 揺れて揺れてこの世界で 愛することも出来ぬまま はかなく散ってゆくのか 花弁なのか ROSIER 愛したキミには ROSIER 近づけない ROSIER 抱き締められない ROSIER 自分さえも"
36,ミュージックビデオ賞,5328,神様の宝石でできた島_by_MIYA・YAMI,さあ 目を閉じて 月が闇へ逃げるまえに 少しだけ眠りなよ 僕もここにいるから そう 僕らは急ぎ過ぎていただけだろう 言い訳を考えるヒマもないくらいに 満月の夜には きっと見えるだろう 遠く離れてても 世界のどこにいても 君と歩き 共に生きた かけがえのない時間だけが 今もなお 星を讃え 輝いているね サヨナラは言わないで いつかまた会えるはずさ 神様の宝石でできた この島で さあ 泣かないで 窓に透ける朝焼けが 君の涙に映っては流れ落ちる そう 僕らはウソに慣れていただけだろう 言い訳を言う優しさもうすれていた 通り雨がきても きっと聴こえるだろう 遠く離れてても 世界のどこにいても 君と唄い 共に生きた かけがえのない想い出が 今もなお 星を讃え まばたいているね サヨナラは言わないで いつかまた会えるはずさ 神様の宝石でてきた この島で 君と歩き 共に生きた かけがえのない時間だけが 今もなお 星を讃え 輝いているね サヨナラは言わないで いつかまた会えるはずさ 神様の宝石でできた この島で 君と会った島で 君と会った島で…
36,優秀賞,5511,月_by_桑田佳祐,遠く遠く海へと下る 忍ぶ川のほとりを歩き 果ての街にたどり着くころ 空の色が悲しく見える 振り返る故郷(ばしょ)は遥か遠くなる 柔らかな胸に抱かれてみたい 君を見ました 月見る花に 泣けてきました 嗚呼… 蒼い月が旅路を照らし 長い影に孤独を悟る 人の夢は浮かんで堕ちて されど赤い陽はまた昇る 啼きながら鳥は何処へ帰るだろう 翔び慣れた夜もひとりじゃ辛い 君と寝ました 他人のままで 惚れていました 嗚呼… 夏の空に流れる星は さわぐ胸をかすめて消えた 波の音に哀しみを知り 白い砂に涙がにじむ 罪深き風が肌を萌やす季節(とき) 酔いながら人は抱かれてみたい 君と寝ました 月夜の蚊帳で 濡れていました 嗚呼… 揺れて見えます 今宵の月は 泣けてきました 嗚呼…
36,優秀賞,3671,花のように鳥のように_by_桂銀淑,そこにあるから 追いかけて 行けば はかない 逃げ水の それが しあわせ あるよでなくて だけど 夢見る 願(がん)かける 花のように 鳥のように 世の中に 生れたら いちずに あるがままの生き方が しあわせに近い 指の間を さらさらと いつの間にやら こぼれ落ち 拾い集めた 欠片(かけら)を見つめ 恋の終わりを 知らされる 花のように 鳥のように 晴れの日も 風の日も 人生 そんなふうに思えたら しあわせに近い 誰が わたしを 捨てるでしょう いつも こんなに 一筋に こころ捧げて なさけをかけて 愛をいっぱい あげたのに 花のように 鳥のように 限りある一生を 信じて 生きることが 何よりも しあわせに近い ラララ… ラララ… ラララララ…… あるがままの生き方が しあわせに近い
36,優秀賞,7704,夜桜お七_by_坂本冬美,赤い鼻緒がぷつりと切れた すげてくれる手ありゃしない 置いてけ堀をけとばして 駆けだす指に血がにじむ さくら さくら いつまで待っても来ぬひとと 死んだひととは おなじこと さくら さくら はな吹雪 燃えて燃やした肌より白い花 浴びてわたしは 夜桜お七 さくら さくら 弥生の空に さくら さくら はな吹雪 口紅をつけて ティッシュをくわえたら 涙が ぽろり もひとつ ぽろり 熱い唇おしあててきた あの日のあんたもういない たいした恋じゃなかったと すくめる肩に風が吹く さくら さくら いつまで待っても来ぬひとと 死んだひととは おなじこと さくら さくら はな吹雪 抱いて抱かれた 二十歳(はたち)の夢のあと おぼろ月夜の 夜桜お七 さくら さくら 見渡すかぎり さくら さくら はな吹雪 さくら さくら さよならあんた さくら さくら はな吹雪
36,優秀賞,5154,恋しさと せつなさと 心強さと_by_篠原涼子 with t.komuro,恋(いと)しさと せつなさと 心強さと いつも感じている あなたへと向って あやまちは おそれずに進むあなたを 涙は見せないで 見つめていたいよ 遠い空を あの日眺めていた やりかけの青春も 経験も そのままで 永遠を夢見ていた あの日を今、 もう2度とくりかえさずに もどらずに生きること 出来なくて あこがれて でも少しずつ理解(わか)ってきた 戦うこと!! 悲しくて 泣きたくて 叫びたくても あなたを 信じてる 言葉にできない あやまちは おそれずに 進むあなたを 涙は見せないで 信じていたいよ 誰の目にも とまることないまま 街角のポスターは 色あせて消えていく だけど あなたへの想いはきっと 消えないで いつまでも 迷(まよ)わずに残ってる 偶然でも 会えなくて でも世界中で1人だけは 伝えたい!! 恋(いと)しさと せつなさと 心強さと いつも感じている あなたへと向って あやまちは おそれずに進むあなたを 涙は見せないで 見つめていたいよ
36,優秀賞,7643,survival dAnce ～no no cry more～_by_TRF,no no cry more 泣かない 想い出 作ったら？ この夏こそは！ この夜こそは！ この街きっと見つかる no no cry more 消えない 足跡 悔やまずに この夢こそは！ この恋こそは！ このチャンスだけ逃したくないよ…！ yeh yeh yeh yeh yeh wow wow wow wow yeh yeh yeh yeh yeh wow wow wow wow yeh yeh yeh yeh yeh survival dAnce！ survival dAnce！ trial dAnce！ yeh yeh yeh yeh yeh wow wow wow wow yeh yeh yeh yeh yeh wow wow wow wow yeh yeh yeh yeh yeh survival dAnce！ survival dAnce！ trial dAnce！ 喧嘩ばかりだよ あの頃も今だって 相変らずの 笑い声と さみしげなあいつはきっと なつかしい草原を 君と2人で歩く 夕陽が傾いても 暗やみが訪れても 映画の幕の様に 終わらない 続いてゆく survival dAnce！！ yeh yeh yeh yeh yeh wow wow wow wow yeh yeh yeh yeh yeh wow wow wow wow yeh yeh yeh yeh yeh survival dAnce！ survival dAnce！ trial dAnce！ yeh yeh yeh yeh yeh wow wow wow wow yeh yeh yeh yeh yeh wow wow wow wow yeh yeh yeh yeh yeh survival dAnce！ survival dAnce！ trial dAnce！ いつか 見た 朝焼けは きっと 思い出せるよ 抱きしめたい 気持ちは とても抑えきれない だけど今日も生きるよ 終わらない 続いてゆく survival dAnce！！ yeh yeh yeh yeh yeh wow wow wow wow yeh yeh yeh yeh yeh wow wow wow wow yeh yeh yeh yeh yeh survival dAnce！ survival dAnce！ trial dAnce！ yeh yeh yeh yeh yeh wow wow wow wow yeh yeh yeh yeh yeh wow wow wow wow yeh yeh yeh yeh yeh survival dAnce！ survival dAnce！ trial dAnce！ no no cry more 泣かない 想い出 作ったら？ この夏こそは！ この夜こそは！ この街きっと見つかる no no cry more 消せない 青春 悔やまずに この夢こそは！ この恋こそは！ このチャンスだけ逃したくないよ…！ yeh yeh yeh yeh yeh wow wow wow wow yeh yeh yeh yeh yeh wow wow wow wow yeh yeh yeh yeh yeh survival dAnce！ survival dAnce！ trial dAnce！ yeh yeh yeh yeh yeh wow wow wow wow yeh yeh yeh yeh yeh wow wow wow wow yeh yeh yeh yeh yeh survival dAnce！ survival dAnce！ trial dAnce！
36,優秀賞,7702,めおと酒_by_長山洋子,苦労かくごと おまえは笑って あとから黙って ついてきた かわいい女(やつ)さ おまえというやつ 倖せまだまだ 遠いけど 抱いてやりたい 細い肩 遅い帰りを 化粧も落とさず おまえは寝ずに 待っている かわいい女(やつ)さ おまえというやつ この俺を信じて いるんだね 明日ののぞみを 捨てないで 陰で流した おまえの涙を ごめんよ拭いても やれないで かわいい女(やつ)さ おまえというやつ 倖せまだまだ 遠いけど せめて飲もうよ めおと酒
36,優秀賞,738,今を抱きしめて_by_NOA,道に迷って独りで泣いた 夜に会いたくて 数えきれない想い重ねた 夢に濡れるまで 蒼い孤独に独り埋もれた 素直になれなくて 濡れた瞳を見つめられなくて 時代に流された 瞳を閉じても 貴方しか見えない 言葉にならない 涙止めて 遠くに見えた貴方の愛を 今は抱きしめて 過ぎ去った季節に貴方が残した 言葉が忘れられなくて 今も… 夢に描いた貴方の愛を 今は抱きしめて 言葉持たずに夜に飛び出した すぐに会いたくて 高鳴る想い二人の胸に抱いて 旅立とう 今を抱きしめて
36,優秀賞,5105,花のワルツ_by_藤あや子,夢で逢いたい抱かれたい あなたの愛の 陽(ひ)だまりに 花よ、花、花 散らないで この世に生きる不条理(かなしみ)に おし流されてしまいそう 泣いちゃいけない よわ虫と わたしの髪を 撫(な)でた人 雨よ、雨、雨 降らないで こころに酒がしみる夜(よ)は グラスが泣いてさみしがる めぐり逢いたいしあわせに おんなの涙 夢しずく 花よ、花、花 泣かないで 流れにうかぶ水草(みずくさ)も ちいさな春を胸に抱く
36,優秀賞,6706,愛が生まれた日_by_藤谷美和子・大内義昭,恋人よ 今 受け止めて あふれる想い あなたの両手で 恋人よ 今 瞳を閉じて 高鳴る胸が 2人の言葉 キャンドルの炎に 揺れてるプロフィール 世界で一番 素敵な夜を 見つめている 愛が生まれた日 この瞬間(とき)に 真実はひとつだけ あなたとならば 生きて行ける 愛が生まれた日 この瞬間(とき)に 永遠が始まるよ 君とだったら 生きて行ける ……めぐり逢えた 恋人よ この腕の中 哀しみさえも 打ち寄せないだろう 恋人よ もし 嵐でも 2人は同じ 入江の小舟 天窓の星より 近くが美しい 未来で一番 輝く過去を 過ごしている 愛が生まれた日 忘れない 運命を信じてる 君がいるなら それだけでいい 愛が生まれた日 忘れない 生きてきたその理由を… あなたがいれば それだけでいい ……めぐり逢えた いくつかの別れと 涙が 地図になり 世界で一番 素敵な場所に 辿りついた 愛が生まれた日 この瞬間(とき)に 真実はひとつだけ あなたとならば 生きて行ける 愛が生まれた日 この瞬間(とき)に 永遠が始まるよ 君とだったら 生きて行ける ……めぐり逢えた
37,最優秀歌唱賞,2294,夢街道_by_山本譲二,少し太めの ワッパを抱いて 男度胸の ころがし稼業 「みやげは無事故で いいのよ」と 云ったあいつの 面影が 浮かぶ夜明けの… 東海道 煽(あお)るつもりは さらさらないが ちゃちな車に つい泣かされる 踏んじゃならない 掟(きま)りの道よ こらえ煙草が 目に沁みる 風よ騒ぐな… 山陽道 軋(きし)むタイヤに 後(あと)振り返りゃ 荷台(はこ)の毘沙門(びしゃもん) はじけた泥に それもいいぜと 笑い顔 今日も明日も 陽は昇る 日本列島… 夢街道
37,最優秀新人賞,8110,桃と林檎の物語_by_美山純子,桃を二つ 買って帰った あなたと 一つずつ 食べようと思って 狭い部屋に 西日がさして あなたは いなかった 夕暮れの手品みたいに こんなはずじゃなかったわ 誰だって 明日なんか 見えないけれど こんなはずじゃなかったわ 蜩の雨の降る中 私 途方に暮れた 前の女と いっしょにいると ふわさが 聞こえるわ 秋風のお節介 あなたいつも 言ってたじゃない 男を だめにする 身勝手な悪い女と 人のことは言えないわ 窓の空 お月さまも 見えないから 人のことは言えないわ 火の消えた煙草くわえて 私 ため息ついた 林檎一つ 赤くさみしく あなたの ことなんか 何もかも忘れた 女ひとり こんな暮らしも いまどき 世間では めずらしい話じゃないわ 白い小雪ちらちらと この冬は 久しぶりに 一人だから 白い小雪ちらちらと 妹を呼んでやろうと 私 手紙を書いた 長い 手紙を書いた
37,レコード大賞,8222,Overnight Sensation ～時代はあなたに委ねてる～_by_TRF,Anyway you want Anytime you need Everybody shakes Everytime dAnce Wo-Overnight Wo-Sensation 20才やそこらじゃ 人生のモチベーション 身についたら気分もしらけるだけだし 友達も同僚も 刺激を受けつつお互いライバル 泣きたくなるほどみじめなゲームで 人生ではじめてのとびきりの BAD TRIP それでも何かと時代が守ってくれる 電話をかければ誰かはつかまる なぐさめの KISS はかんたんにはいかないけど 時代が何とか気持ちを落ちつかせている Anyway you want Anytime you need 輝く世界が欲しかったら立ち上がろう Everybody shakes Everytime dAnce ハングリーな精神で動こう Anyway you want Anytime you need 荒れる波を乗り越えて行きたかったら Everybody shakes Everytime dAnce 嵐をさけてく知恵を養おう Wo-Overnight Wo-Sensation 仕事も恋愛も欲望のかたまり 勢いまかせで 失敗したって 人間のバイブレーション12年で1回 必ずラッキーがまわってくるらしいよ 誰でも一夜の夢を見ている たとえば交差点でロマンスの様な… それでも何かと世間は冷たくあしらう 学校に行きたきゃ 勉強もできるよ 毎晩うたって楽しく生きれる 時代は全てをあなたに委ねてる Anyway you want Anytime you need きらめく勇気を身につけたかったら Everybody shakes Everytime dAnce ハードな精神で戦おう走ろう Anyway you want Anytime you need 輝く世界が欲しかったら立ち上がろう Everybody shakes Everytime dAnce ハングリーな精神で動こう Everybody shakes Everytime dAnce ハングリーな精神で動こう Anyway you want Anytime you need 荒れる波を乗り越えて行きたかったら Everybody shakes Everytime dAnce 嵐をさけてく知恵を養おう Anyway you want Anytime you need きらめく勇気を身につけたかったら Everybody shakes Everytime dAnce ハードな精神で戦おう走ろう
