回数,賞,ID,song_by,歌詞
50,優秀作品賞,70284,やぁ 無情_by_斉藤和義,やぁ 無情 また会ったな だけどオマエに用はないぜ やぁ 無情 どっか行けよ どうせオレがバカなんだろ 話かけるな 顔を見せるな いいかげん後ろについてくんなよ ヘラヘラすんな ニヤニヤすんな もうその手を放してくれ やぁ 無情 切ないな またオマエの仕業なんだろ でもあの女(ひと)にだけは手を出すな! どんなに頑張ってみても どんなに愛しても あなたに届かない 何かが届かない 明日は夜が明けるよ その夢の闘いも やぁ 無情 また会ったな なにを探しているんだい やぁ 無情 どっか行けよ また誰か傷つける気だろ 転んだ人の背中の上で 澄ました顔して ダランダーラ 自分が一番 この世で一番 忙しそうに ダランラン やぁ 無情 切ないな またオマエの仕業なんだろ でもあの女(ひと)にだけは手を出すな! ここは今どこなんだろう どこまで来たんだろう あなたはすぐそばで ただ笑っているね 明日は夜が明けるよ その夢の闘いも やぁ 無情 星がきれいだ ごめんね 愛しい やさしい女(ひと) どんなに頑張ってみても どんなに愛しても あなたに届かない 何かが届かない 明日は夜が明けるよ 破れかけた運命も ここは今どこなんだろう どこまで来たんだろう 後ろをついてくる よく似た影法師 物語は続くよ この夢の闘いも
50,優秀作品賞,63505,輪島朝市_by_水森かおり,愛をなくした 心のように 空は重たい 鉛色 輪島朝市… 涙をひとり 捨てに来た 寒さこらえて 店出す人の 声がやさしい 能登訛り 知らず知らずに わがままばかり 無理を通して いたみたい 輪島朝市… 女の夢は 帰らない 詫びの手紙を あなたに当てて 書いてまた消す 旅の宿 まるで私を 見送るように 沖は潮鳴り 風が泣く 輪島朝市… 出直すための 足がかり 強く生きろの 言葉をあとに 明日へ踏み出す 能登めぐり
51,レコード大賞,78716,Someday_by_EXILE,"(Someday, Someday) このまま歩けば いつかは たどりつけるかな 変わらない この思いだけを 信じて... このまま終われない 何かが突き動かすんだ それはきっと 魂を残す道しるべ 答え出すこと 迷ったとしても 必ず間違ってなかったと 思えるよ あれから 数えきれないほど 夢を叶えてきたけど 心はまだ 君を思ってるよ あなたが ずっとあなたらしく 生き続けられるように 変わらない 思い抱き締めながら 歌ってくよ (Someday, Someday) この空見上げたら 限界なんてないはずで 果てしない 可能性がある そう思える 悲しみ、悔しさも 挑戦していくことで 力に変えてゆけるから 必ず つらいときこそ 信じ続ける いつかきっとわかるだろう その意味を... 心は まだ未来を見てる 果てしない夢を抱きしめて 君の幸せ 祈っているから あなたが ずっと笑顔のまま 生き続けられるように 心から強く願い あの光ヘ 走り抜ける あれから 数えきれないほど 夢を叶えてきたけど 心はまだ 君を思ってるよ あなたが ずっとあなたらしく 生き続けられるように 変わらない 思い抱き締めながら 歌ってくよ (Someday, Someday)"
51,優秀作品賞,78716,Someday_by_EXILE,"(Someday, Someday) このまま歩けば いつかは たどりつけるかな 変わらない この思いだけを 信じて... このまま終われない 何かが突き動かすんだ それはきっと 魂を残す道しるべ 答え出すこと 迷ったとしても 必ず間違ってなかったと 思えるよ あれから 数えきれないほど 夢を叶えてきたけど 心はまだ 君を思ってるよ あなたが ずっとあなたらしく 生き続けられるように 変わらない 思い抱き締めながら 歌ってくよ (Someday, Someday) この空見上げたら 限界なんてないはずで 果てしない 可能性がある そう思える 悲しみ、悔しさも 挑戦していくことで 力に変えてゆけるから 必ず つらいときこそ 信じ続ける いつかきっとわかるだろう その意味を... 心は まだ未来を見てる 果てしない夢を抱きしめて 君の幸せ 祈っているから あなたが ずっと笑顔のまま 生き続けられるように 心から強く願い あの光ヘ 走り抜ける あれから 数えきれないほど 夢を叶えてきたけど 心はまだ 君を思ってるよ あなたが ずっとあなたらしく 生き続けられるように 変わらない 思い抱き締めながら 歌ってくよ (Someday, Someday)"
51,優秀作品賞,77229,安芸の宮島_by_水森かおり,ひとりで旅する おんなの背中 泣いているよに 見えますか あなたをどんなに 愛しても いつかこころの すれ違い 安芸の宮島 朱色の鳥居 胸の痛みを わかって欲しい… 感じていました あなたはいつも 愛の狭間(はざま)で 揺れていた こんなに小さな 指輪でも 捨てる勇気が ありません 安芸の宮島 弥山(みせん)に立てば 瀬戸は引き潮 涙でかすむ… 未練という名の こころの霧は いつになったら 晴れますか あなたを忘れる おんな旅 今日で終わりに したいから 安芸の宮島 夕陽の海よ 生まれ変われる あしたが欲しい…
51,優秀作品賞,80538,Infinity_by_girl next door,そんな顔してうつむかないで… らしくないよ、とキミが笑った どんな迷路も出口はあるよ… 優しい声に風を感じた 孤独という部屋から出る その謎の鍵は、 どんな時もその手にある 自分次第なんだ Woo woo woo yeh! 無限の空に抱かれて ぼくらは生きているんだ ドアを開けて飛び出せば、 未来という新しい場所で キミは輝いてる 空の彼方を目指してゆけば、 心の中にたどり着くはず 宇宙に果てがないと示した、 方程式がそこにあるんだ きれいごと、とワラうならば 永遠に出れない 千里の道、越える旅へ 一歩踏み出すんだ Woo woo woo yeh! 逆風(むかいかぜ)を受け止めて 走り出せば舞い上がる ぐるぐるまわる世界を、 猛スピードで翔け抜けてゆこう! 明日を知るために Woo woo woo yeh! いえない思い閉じ込めた 強がり、なのに寂しがり 目に映ることだけでは人は解(わか)らない だから素顔のキミに会えるまで、 ここにいる Woo woo woo yeh! 無限の空に抱かれて ぼくらは生きているんだ ドアを開けて飛び出せば、 未来という新しい場所で キミは輝いてる
51,優秀作品賞,84214,YELL_by_いきものがかり,「“わたし”は今 どこに在るの」と 踏みしめた足跡を 何度も見つめ返す 枯葉を抱き 秋めく窓辺に かじかんだ指先で 夢を描いた 翼はあるのに 飛べずにいるんだ ひとりになるのが 恐くて つらくて 優しいひだまりに 肩寄せる日々を 越えて 僕ら 孤独な夢へと歩く サヨナラは悲しい言葉じゃない それぞれの夢へと僕らを繋ぐ YELL ともに過ごした日々を胸に抱いて 飛び立つよ 独りで 未来(つぎ)の 空へ 僕らはなぜ 答えを焦って 宛ての無い暗がりに 自己(じぶん)を探すのだろう 誰かをただ 想う涙も 真っ直ぐな 笑顔も ここに在るのに “ほんとうの自分”を 誰かの台詞(ことば)で 繕うことに 逃れて 迷って ありのままの弱さと 向き合う強さを つかみ 僕ら 初めて 明日へと 駆ける サヨナラを誰かに告げるたびに 僕らまた変われる 強くなれるかな たとえ違う空へ飛び立とうとも 途絶えはしない想いよ 今も胸に 永遠など無いと 気づいたときから 笑い合ったあの日も 唄い合ったあの日も 強く 深く 胸に 刻まれていく だからこそあなたは だからこそ僕らは 他の誰でもない 誰にも負けない 声を 挙げて “わたし”を 生きていくよと 約束したんだ ひとり ひとり ひとつ ひとつ 道を 選んだ サヨナラは悲しい言葉じゃない それぞれの夢へと僕らを繋ぐ YELL いつかまためぐり逢うそのときまで 忘れはしない誇りよ 友よ 空へ 僕らが分かち合う言葉がある こころからこころへ 声を繋ぐ YELL ともに過ごした日々を胸に抱いて 飛び立つよ 独りで 未来(つぎ)の 空へ
51,優秀作品賞,79085,おまえを連れて_by_北川大介,こころのどこかで 探してた 生きる幸せやすらぎ くれる女(ひと) おまえと行きたい… 潮の香りにむせび哭く あの霧笛 俺の育った 街だから 連れてゆきたい… 港まち神戸 いとしい想いが この胸に じんと募るよ日毎に 嘘じゃない おまえとふたりで… 夜の元町・三宮 歩こうか ちょっとオシャレな あの酒場 連れてゆきたい… 想い出の神戸 あの夜(よ)の出逢いが なかったら 夢にはぐれていただろ 今頃は おまえに見せたい… 船の灯りが揺れている 北埠頭 俺の愛した 街だから 連れてゆきたい… 港まち神戸
51,優秀作品賞,70938,手紙～親愛なる子供たちへ～_by_樋口了一,年老いた私が、ある日、今までの私と違っていたとしても どうかそのままの私のことを理解して欲しい 私が服の上に食べ物をこぼしても 靴ひもを結び忘れても あなたに色んなことを教えたように見守って欲しい あなたと話す時 同じ話を何度も何度も繰り返しても その結末をどうかさえぎらずにうなずいて欲しい あなたにせがまれて繰り返し読んだ絵本のあたたかな結末は いつも同じでも私の心を平和にしてくれた 悲しい事ではないんだ 消え去ってゆくように 見える私の心へと 励ましのまなざしを向けて欲しい 楽しいひと時に 私が思わず下着を濡らしてしまったり お風呂に入るのをいやがるときには思い出して欲しい あなたを追い回し 何度も着替えさせたり 様々な理由をつけて いやがるあなたとお風呂に入った 懐かしい日のことを 悲しいことではないんだ 旅立ちの前の 準備をしている私に 祝福の祈りを捧げて欲しい いずれ歯も弱り、飲み込む事さえ出来なくなるかも知れない 足も衰えて立ち上がる事すら出来なくなったなら あなたが か弱い足で立ち上がろうと私に助けを求めたように よろめく私に どうかあなたの手を握らせて欲しい 私の姿を見て悲しんだり 自分が無力だと思わないで欲しい あなたを抱きしめる力がないのを知るのはつらい事だけど 私を理解して 支えてくれる心だけを持っていて欲しい きっとそれだけでそれだけで私には勇気がわいてくるのです あなたの人生の始まりに私がしっかりと付き添ったように 私の人生の終わりに少しだけ付き添って欲しい あなたが生まれてくれたことで私が受けた多くの喜びと あなたに対する変わらぬ愛を持って笑顔で答えたい 私の子供たちへ 愛する子供たちへ
51,優秀作品賞,80883,Stand by U_by_東方神起,君が「サヨナラ」も告げずに出て行ったあの日から この街の景色や匂いが変わった気がするよ 君の全てになりたくて交わした約束も 果たされないまま思い出に変わってしまう ひとりきりで君が泣いたあの時 すぐに飛んで行けば 今もまだ君は僕の横にいてくれた? 出来るならばもう一度言いたかった 「大好き」って... 君への想いも 溢れ出した言葉も 今は届かない 君は何処にいて 誰と何処にいて どんな服を着て 何して笑ってるんだろう? 僕はここにいて 今もここにいて 君とふたりでまた 会えると信じているよ Oh... 変わらず 想っているよ 君だけ... 想っているよ 結んだ髪の後ろ姿に君を重ねて 振り返る見知らぬ誰かに 何度もガッカリした 着信がある度 君の名前期待したり カッコ悪い毎日ばかり 過ぎていくよ 「忘れられない」のが嘘で 本当は「忘れたくない」だけ “強がり”が僕らしさならば もういらない 君がいなきゃもう二度と感じない 「しあわせ」って... どう頑張ってみても こぼれ落ちた涙は すぐに止まらない 君は何処にいて 誰と何処にいて どんな服を着て 何して笑ってるんだろう? 僕はここにいて 今もここにいて 君とふたりでまた 会えると信じているよ だから今こうして 僕はまたひとり君の名前呼んでる... これ以上 切なさを抱きしめていけるわけなどないよ でもそれしかないんだよ 君がいるだけで 輝いて見えた あの頃は二度と 戻っては来ないけど 何が起こっても 何を失っても 君を愛したこと 決して忘れたくない 君が何処にいて 誰と何処にいて どんな夢を見て 何して笑っていても ずっとここにいて 今もここにいて 君といつの日にか 会えると信じているよ Oh... 変わらず 想っているよ 君だけ... 想っているよ
51,優秀作品賞,83705,ときめきのルンバ_by_氷川きよし,教えてほしい 涙の理由(わけ)を 僕でいいなら そばにおいでよ ひとりグラスに ため息ついてる その横顔が 何故(なぜ)かいとしい 誰も知らない ふたりの時間 世界の薔薇(はな)が ひらくとき…… 愛してルンバ 恋してルンバ ときめきのルンバ 忘れてほしい 過去(むかし)の傷(こと)は そばにいるから 淋しいときは 古いピアノも やさしく歌うよ ふたりのために 甘いメロディ 百(ひゃく)の言葉を 囁(ささや)くよりも 心をこめて 見つめたい…… 愛してルンバ 恋してルンバ ときめきのルンバ 信じてほしい この幸せを ごらんあの夜空(そら) 星がきらめく なにがあっても つないだ手と手は 離しはしない ずっと一緒さ 永遠に流れる ふたりの時間 夢ならどうか 覚めないで…… 愛してルンバ 恋してルンバ ときめきのルンバ ときめきのルンバ
51,優秀作品賞,74305,また君に恋してる_by_坂本冬美,朝露が招く 光を浴びて はじめてのように ふれる頬 てのひらに伝う 君の寝息に 過ぎてきた時が 報われる いつか風が 散らした花も 季節巡り 色をつけるよ また君に恋してる いままでよりも深く まだ君を好きになれる 心から 若かっただけで 許された罪 残った傷にも 陽が滲む 幸せの意味に 戸惑うときも ふたりは気持ちを つないでた いつか雨に 失くした空も 涙ふけば 虹も架かるよ また君に恋してる いままでよりも深く まだ君を好きになれる 心から また君に恋してる いままでよりも深く まだ君を好きになれる 心から
51,優秀作品賞,81523,Lick me_by_倖田來未,Everything all right！ Don't be afraid 自信を持って行こうよ！ みんなの人気者だけど It's all right！ 見渡す限り太陽 海と笑顔溢れている 目的はそうです Ice cream のような彼女 一口味わうと手遅れ とろけちゃう位の甘さ 味わい過ぎたら危険(ダメ) (＞=＜) Come on come on come on Everything all right！ Don't be afraid 自信を持って行こうよ！ みんなの人気者だけど Everything go go！ Never mind go 見つめられるたび衝撃走る 君のことをもっと知りたい空に向かって Everything all right！ 暑い日にも寒い日にも 不意に欲しくなってしまうんだ よそ見をしていたら 誰かに食べられちゃうかも！？ 甘い香りで包まれたら クラクラしちゃうけれど Oh baby いつでも Come on come on come on Everything all right！ Don't be afraid この夏暑い日差し 溶けちゃわないようにね Everything go go！ Never mind go 止められない気持ちに Oh baby もう他にはいけない君の虜さずっと Everything all right！ Everything all right！ Don't be afraid 自信を持って行こうよ！ みんなの人気者だけど Everything go go！ Never mind go 見つめられるたび衝撃走る 君のことをもっと知りたい空に向かって Everything all right！！
51,優秀作品賞,79482,Rain is Fallin'_by_w-inds.×G-DRAGON(BIG BANG),"steppin' in the club everybodys like“aye!!!” yeah dats my jam they play i roll to the bar and cop me a drink--im tipsy, game on, i say! i gotta get right, i sho do this shorty im so into and i think she just came thru hey baby girl, wut it do? (i think i kno u too)[He-he-he-he-he-he-he-he-hey] C'mon, into the night, DISCOTIC☆NIGHT サプライズでオーガナイズ! 君を皆に紹介したい I gotta feelin' that this could be the night Wow-wow, wow-wow, yeah-yeah-yeah Rain is fallin' over you & me もっと浴びよう スポットライト&シャンパン C'mon, c'-c'-c'mon I love you! You've just changed me [Yeah-yeah-yeah-yeah, you have] かつてのスキャンダラスでデンジャラスな、恋を逸らす僕はもういない。 …君との出逢い以来。 aye aye put 'em up to the ceiling mayday mayday im softly killin let the beat take control of you let the bass drum come rollin' through dancin, movin, steppin, grooving, jumpin, come on do as you choose cause we gon' keep this true its just GD and U (and u and u)[He-he-he-he-he-he-he-he-hey] C'mon, into the night, DISCOTIC☆NIGHT 80's music と君に踊らされたい…! I got a feelin' that this could be the night Wow-wow(wow-wow), wow-wow, yeah-yeah-yeah Rain is fallin' over you & me もっと浴びよう スポットライト&シャンパン C'mon, c'-c'-c'mon [浴びるスポットライト・シャンパン] I love you! You've just changed me [I love you! You've just changed me] かつてのスキャンダラスでデンジャラスな、恋を逸らす僕はもういない。 …君との出逢い以来。 We go all night long! [We go all night long!] We go on & on! [We go on & on!] まるで流行りのよう [まるで流行りのよう] 回るよ ミラーボール [回るミラーボール] でも愛は普遍 いつの世でも無限大 So you & I should be so lucky! Yeah Rain is fallin' over you & me [Rain is fallin'!] もっと浴びよう スポットライト&シャンパン C'mon, c'-c'-c'mon I love you! You've just changed me [Wow-wow-wow-wow, I love you] かつてのスキャンダラスでデンジャラスな、恋を逸らす僕はもういない。 …君との出逢い以来。[出逢い以来] Rain is fallin' over you & me もっと浴びよう スポットライト[Oh!] &シャンパン[Oh!] C'mon, c'-c'-c'mon I love you! You've just changed me [Wow-wow-wow-wow-wow-wow] かつてのスキャンダラスでデンジャラスな、恋を逸らす僕はもういない。 …君との出逢い以来。[君との出逢い以来"
52,レコード大賞,102471,I Wish For You_by_EXILE,"いつでも君の為にI wish 幸せを願う事こそが愛 夢を見れば恋をすれば 誰にでも悩める日が来るから I wish, I wish, I wish for you I wish, I wish, I wish for you I wish, I wish, I wish for you always baby どうせ自分を騙せないDeep down だから自分で変えていくしかないKeep up 沈まない太陽欠けない月のようなデザイア 守りたい救いたいメサイアのように いつでも君の為にI wish 幸せを願う事こそが愛 夢を見れば恋をすれば 誰にでも悩める日が来るから I wish, I wish, I wish for you I wish, I wish, I wish for you I wish, I wish, I wish for you always baby 望むのなら叶うまでDo it all 掴めるのなら迷わずTake it all 雨を見つめているより走り出して行くような 心には光がさすHold on now いつでも君の為にI wish 幸せを願う事こそが愛 夢を見れば恋をすれば 誰にでも悩める日が来るから I wish, I wish, I wish for you I wish, I wish, I wish for you I wish, I wish, I wish for you always baby 今が全てじゃない事など 既に知っているだろう? 移ろいゆくState of mind ここにあらずOut of mind それじゃ見えない 辿り着けない まずは君が願いを掛けて Right place! Right time! Get set go! いつでも君の為にI wish 幸せを願う事こそが愛 夢を見れば恋をすれば 誰にでも悩める日が来るから I wish, I wish, I wish for you I wish, I wish, I wish for you I wish, I wish, I wish for you I wish, I wish I wish, I wish I wish, I wish I wish, I wish for you いつでも君の為にI wish 幸せを願う事こそが愛 夢を見れば恋をすれば 誰にでも悩める日が来るから I wish, I wish, I wish for you I wish, I wish, I wish for you I wish, I wish, I wish for you always baby"
52,優秀作品賞,102471,I Wish For You_by_EXILE,"いつでも君の為にI wish 幸せを願う事こそが愛 夢を見れば恋をすれば 誰にでも悩める日が来るから I wish, I wish, I wish for you I wish, I wish, I wish for you I wish, I wish, I wish for you always baby どうせ自分を騙せないDeep down だから自分で変えていくしかないKeep up 沈まない太陽欠けない月のようなデザイア 守りたい救いたいメサイアのように いつでも君の為にI wish 幸せを願う事こそが愛 夢を見れば恋をすれば 誰にでも悩める日が来るから I wish, I wish, I wish for you I wish, I wish, I wish for you I wish, I wish, I wish for you always baby 望むのなら叶うまでDo it all 掴めるのなら迷わずTake it all 雨を見つめているより走り出して行くような 心には光がさすHold on now いつでも君の為にI wish 幸せを願う事こそが愛 夢を見れば恋をすれば 誰にでも悩める日が来るから I wish, I wish, I wish for you I wish, I wish, I wish for you I wish, I wish, I wish for you always baby 今が全てじゃない事など 既に知っているだろう? 移ろいゆくState of mind ここにあらずOut of mind それじゃ見えない 辿り着けない まずは君が願いを掛けて Right place! Right time! Get set go! いつでも君の為にI wish 幸せを願う事こそが愛 夢を見れば恋をすれば 誰にでも悩める日が来るから I wish, I wish, I wish for you I wish, I wish, I wish for you I wish, I wish, I wish for you I wish, I wish I wish, I wish I wish, I wish I wish, I wish for you いつでも君の為にI wish 幸せを願う事こそが愛 夢を見れば恋をすれば 誰にでも悩める日が来るから I wish, I wish, I wish for you I wish, I wish, I wish for you I wish, I wish, I wish for you always baby"
52,優秀作品賞,93785,逢いたい理由_by_AAA,もう戻れないよ 世界中の時計を壊しても 二人の時間は未来へと動き出してる 君と手を繋ぐみたいにケータイ握り締めていた 指先の言葉じゃ物足りない この想いは 言葉にすればよくあるフレーズ なのにキー打つ手が震える うつぶせのまま放つ言葉の礫を 今日も握りしめた 空回る気持ちのまま 跨ぐ日付の中 ただ目を閉じたら君を感じれたから 夢の中で眠るみたい 君の隣はあたたかくて 何処に居ても真夜中でも 君のことを考えてる 逢いたいと想う理由を 変換してまた消して ただ逢いたいと伝えるだけで 何時間過ぎただろう そばにいると無敵になる 何も怖くなくなるから なのにいつも一人になると 君の声が聞きたくなる 君のために強くなるよ ツライこともがんばれるよ だけどいつも泣きたくなると 君の笑顔が見たくなる 逢いたいと想う理由が 君に恋してるせいなら 逢いたいと言えないワケは 恋が儚すぎるせいで もう止まれないよ この出逢いが何かの間違いで 別れの運命(さだめ)が未来まで続いていても 誰よりも君に似合う自分自身になりたくて なのに作り笑顔と嘘ばかり上手になる 一人部屋で無口になる 何をしてもイライラする 膝を抱え眠れないのは 君の声が聞きたいから 君のせいで弱くなるよ もう一人で歩けないよ だけどいつも強がってるよ 君の笑顔が見たいから 逢いたいと想う理由を 変換してまた消して 逢いたいと伝えるだけで 何時間過ぎただろう 逢いたいと想う理由が 君に恋してるせいなら 逢いたいと言えないワケは 恋が儚すぎるせいで
