回数,賞,ID,song_by,歌詞
1,大賞,181713,黒い花びら_by_水原弘,黒い花びら 静かに散った あの人は帰らぬ 遠い夢 俺は知ってる 恋の悲しさ 恋の苦しさ だから だから もう恋なんか したくない したくないのさ 黒い花びら 涙にうかべ 今は亡いあの人 あゝ 初恋 俺は知ってる 恋の淋しさ 恋の切なさ だから だから もう恋なんか したくない したくないのさ
1,歌唱賞,42705,夜霧に消えたチャコ_by_フランク永井,俺のこころを 知りながら なんでだまって 消えたんだ チャコ チャコ 酒場に咲いた 花だけど あの娘は可憐な 可憐な 娘だったよ 夢のないのが 淋しいと 霧に濡らした 白い頬 チャコ チャコ 忘れはしない いつまでも あの日の悲しい 悲しい まなざしを 青いネオンが 泣いている 紅いネオンも 涙ぐむ チャコ チャコ 帰っておくれ もう一度 俺のせつない せつない この胸に
1,童謡賞,No ID!,やさしい和尚さん_by_石井亀次郎とキングホウズキ会,和尚さん 和尚さん やさしい やさしい 和尚さん ひらひら もみじが ちってくる そうじゃよ そうじゃよ この寺の 名物もみじじゃ みてごらん  和尚さん 和尚さん それでも おそうじ たいへんね みんなで てつだい いたしましょ そりゃそりゃ ごくろうな ことじゃがのう ひとつてつだい たのみましょう  もく兵衛があげた ぼたもちじゃ ほっぺのとびそな ぼたもちじゃ さあさあ おあがり ごほうびじゃ それそれ ほっぺに あんこが ぺたりと くっついた
2,大賞,13077,誰よりも君を愛す_by_松尾和子＆和田弘とマヒナスターズ,誰にも云われず たがいに誓った かりそめの恋なら 忘れもしようが ああ 夢ではない ただひとすじ 誰よりも 誰よりも君を愛す 愛した時から 苦しみがはじまる 愛された時から わかれが待っている ああ それでもなお 命かけて 誰よりも 誰よりも君を愛す あなたがなければ 生きてはゆけない あなたがあるから 明日が生きられる ああ いく歳月 変ることなく 誰よりも 誰よりも君を愛す
2,歌唱賞,14764,哀愁波止場_by_美空ひばり,夜の波止場にゃ 誰あれもいない 霧にブイの灯 泣くばかり おどま盆ぎり盆ぎり 盆からさきゃ おらんと…… あの人の好きな歌 波がつぶやく淋しさよ あゝ今夜もブイの灯が…… 冷たい私の心のようにうるんでいる あの人のいない港は 暗い海の波のように淋しいわ…… あの人がいつも唄った歌が 今夜も私を泣かすのね 三月待っても 逢うのは一夜 恋も悲しい 波止場町 五ッ木くずしは しんから泣けるよ…… 思い出の滲む歌 耳に残って離れない
2,童謡賞,No ID!,ゆうらんバス_by_水上房子／キング小鳩会,Not Found...
2,新人賞,13868,潮来笠_by_橋幸夫,潮来の伊太郎 ちょっと見なれば 薄情そうな 渡り鳥 それでいいのさ あの移り気な 風が吹くまま 西東 なのにヨー なぜに眼に浮く潮来笠 田笠の紅緒が ちらつくようぢゃ 振り分け荷物 重かろに わけはきくなと 笑ってみせる 粋な単衣の 腕まくり なのにヨー 後髪引く潮来笠 旅空夜空で いまさら知った 女の胸の 底の底 ここは関宿 大利根川へ 人にかくして 流す花 だってヨー あの娘川下潮来笠
3,大賞,13078,君恋し_by_フランク永井,宵闇せまれば 悩みは涯なし みだるる心に うつるは誰が影 君恋し 唇あせねど 涙はあふれて 今宵も更け行く 唄声すぎゆき 足音ひびけど いずこにたずねん こころの面影 君恋し おもいはみだれて 苦しき幾夜を 誰がため忍ばん 君恋し 唇あせねど 涙はあふれて 今宵も更け行く 今宵も更け行く 今宵も更け行く……
3,歌唱賞,42608,硝子のジョニー_by_アイ・ジョージ,黒い面影 夜霧に濡れて ギターも泣いてる ジョニーよどこに 何時は消えてゆく 恋の夢よ 赤い花束 泪にうるむ 何故か帰らぬ ジョニーよどこに いつまた逢える日 淡い夢よ 黒い太陽 まぶたに消えて むなしいグラスよ ジョニーよどこに 語らんいついつ 恋の夢よ
3,童謡賞,206438,かかしのねがいごと_by_楠トシエ,かかしが 一本足じゃ くたびれるってさ もう一本足(あんよ)がほしいと いってました かかしが みの笠じゃ 古くさいってさ レインコートに こうもりほしいと いってました かかしも ちかごろじゃ ぜいたくいってさ みんなのまねして おしゃれがしたいのね かかしの ねがいごと かなったとさ ふるい洋服きせられて すましてた
3,新人奨励賞,43658,川は流れる_by_仲宗根美樹,病葉(わくらば)を きょうも浮かべて 街(まち)の谷 川は流れる ささやかな 望み破れて 哀(かな)しみに 染まる瞳(ひとみ)に たそがれの 水のまぶしさ 思い出の 橋のたもとに 錆(さび)ついた 夢のかずかず ある人は 心つめたく ある人は 好きで別れて 吹き抜ける 風に泣いてる ともしびも 薄い谷間を 一筋に 川は流れる 人の世の 塵(ちり)にまみれて なお生きる 水をみつめて 嘆くまい あすは明るく
3,新人奨励賞,No ID!,団地のお嬢さん_by_山中みゆき,Not Found...
3,新人奨励賞,No ID!,白い花のブルース_by_平野こうじ,想いをこめて 白い花投げれば落ちよ あの胸に落ちたら可愛い ブローチになってもおくれ 白い花面影ばかり 目に浮かぶあなたは今じゃ 遠い人この花風に 流される悲しい恋の なごり花想い出の花 白い花一輪空に 投げ上げるたそがれどきの 丘の上わかれた人の 恋しさよ
3,新人奨励賞,13871,湖愁_by_松島アキラ,悲しい恋の なきがらは そっと流そう 泣かないで かわいあの娘よ さようなら たそがれ迫る 湖の 水に浮かべる 木の葉舟 ひとり旅の 淋しさは 知っていたのさ 始めから はぐれ小鳩か 白樺の 梢に一羽 ほろほろと 泣いて涙で 誰を呼ぶ 夕星ひとつ またひとつ ぬれた瞳を しのばせる 想い出すまい 嘆くまい 東京は遠い あの峰を 越えてはるかな 空のはて
3,新人奨励賞,No ID!,むすめ三度笠_by_蔵野たつ美,Not Found...
3,新人奨励賞,59390,さいはての唄_by_柳うた子,逢わぬ先から お別れが 待っていました 北の町 行かなきゃならない アリューシャン 行かせたくない 人なのに どうせ私は にしん場の 街の夜風に 咲いた花 こんどあなたの かえるまで 咲いているやら いないやら 灯り凍てつく ノサップの 海を北へと いそぐ船 男なりゃこそ 唇に 含む笑顔も 辛かろう 雪に埋もれた ハボマイにゃ 死んだ親御の 墓もある 飲ませてやりたや 好きな酒 あなた代りに 注がせてね あなた代りに 注がせてね
4,大賞,13079,いつでも夢を_by_橋幸夫＆吉永小百合,星よりひそかに 雨よりやさしく あの娘はいつも歌ってる 声がきこえる 淋しい胸に 涙に濡れたこの胸に 言っているいる お持ちなさいな いつでも夢を いつでも夢を 星よりひそかに 雨よりやさしく あの娘はいつも歌ってる 歩いて歩いて 悲しい夜更けも あの娘の声は流れくる すすり泣いてる この顔上げて きいてる歌の懐しさ 言っているいる お持ちなさいな いつでも夢を いつでも夢を 歩いて歩いて 悲しい夜更けも あの娘の声は流れくる 言っているいる お持ちなさいな いつでも夢を いつでも夢を はかない涙を うれしい涙に あの娘はかえる 歌声で
4,歌唱賞,67115,星屑の町_by_三橋美智也,両手を回して 帰ろ 揺れながら 涙の中を たったひとりで やさしかった 夢にはぐれず 瞼(まぶた)を閉じて 帰ろ まだ遠い 赤いともしび 指笛吹いて 帰ろ 揺れながら 星屑(ほしくず)わけて 町を離れて 忘れない 花のかずかず 瞼を閉じて 帰ろ 思い出の 道をひとすじ 両手を回して 帰ろ 揺れながら 涙の中を たったひとりで
4,童謡賞,5948,ちいさい秋みつけた_by_童謡・唱歌,だれかさんが だれかさんが だれかさんが みつけた ちいさい あき ちいさい あき ちいさい あき みつけた めかくしおにさん ての なるほうへ すました おみみに かすかに しみた よんでる くちぶえ もずの こえ ちいさい あき ちいさい あき ちいさい あき みつけた だれかさんが だれかさんが だれかさんが みつけた ちいさい あき ちいさい あき ちいさい あき みつけた おへやは きたむき くもりの ガラス うつろな めのいろ とかした ミルク わずかな すきから あきの かぜ ちいさい あき ちいさい あき ちいさい あき みつけた だれかさんが だれかさんが だれかさんが みつけた ちいさい あき ちいさい あき ちいさい あき みつけた むかしの むかしの かざみの とりの ぼやけた とさかに はぜのは ひとつ はぜのは あかくて いりひいろ ちいさい あき ちいさい あき ちいさい あき みつけた
4,新人賞,43605,なみだ船_by_北島三郎,涙の終りの ひと滴(しずく) ゴムのかっぱに しみとおる どうせおいらは ヤン衆かもめ 泣くな怨むな 北海の 海に芽をふく 恋の花 クルクル 帆綱(ほづな)を 巻きあげて 暁(あけ)の千島を 忍び立ち あてにゃすまいぞ ヤン衆かもめ 舵であやつる 舟のよに 女心は ままならぬ 惚れたら遠慮は できまいが いやというなら ぜひもない 夢をみるなよ ヤン衆かもめ にしん枕に 北海の 月に哀しや 泪船
4,新人賞,43661,下町の太陽_by_倍賞千恵子,下町の空に かがやく太陽は よろこびと 悲しみ写す ガラス窓 心のいたむ その朝は 足音しみる 橋の上 あゝ太陽に 呼びかける 下町の恋を 育てた太陽は 縁日に 二人で分けた 丸いあめ 口さえ聞けず 別れては 祭りの午後の なつかしく あゝ太陽に 涙ぐむ 下町の屋根を 温(ぬく)める太陽は 貧しくも 笑顔を消さぬ 母の顔 悩みを夢を うちあけて 路地にも幸の くるように あゝ太陽と 今日もまた
5,大賞,187651,こんにちは赤ちゃん_by_梓みちよ,こんにちは赤ちゃん あなたの笑顔 こんにちは赤ちゃんあなたの泣き声 その小さな手 つぶらな瞳 はじめまして わたしがママよ こんにちは赤ちゃん あなたの生命(いのち) こんにちは赤ちゃんあなたの未来に この幸福(しあわせ)が パパの希望(のぞみ)よ はじめまして わたしがママよ ふたりだけの愛のしるし すこやかに美しく 育てといのる こんにちは赤ちゃんお願いがあるの こんにちは赤ちゃん ときどきはパパと ホラ ふたりだけの 静かな夜を つくってほしいの おやすみなさい おねがい赤ちゃん おやすみ赤ちゃん わたしがママよ
5,歌唱賞,244063,赤ちゃんは王様だ_by_フランク永井,赤ちゃんは 王様だ 裸の 王様だ 笑ったら 王様だ 泣いていたって 王様だ やってこい 飛んでこい こうのとりと いっしょに やってこい 飛んでこい おもちゃと いっしょに 赤ちゃんは 王様だ 裸の 王様だ みんなの 王様だ 赤ちゃんは 王様だ 裸の 王様だ 声だしたら 王様だ だまっていたって 王様だ やってこい 飛んでこい こうのとりと いっしょに やってこい 飛んでこい 名前と いっしょに 赤ちゃんは 王様だ 裸の 王様だ みんなの 王様だ 赤ちゃんは 王様だ 裸の 王様だ 目をさましたら 王様だ ねむっていたって 王様だ やってこい 飛んでこい こうのとりと いっしょに やってこい 飛んでこい ママと いっしょに 赤ちゃんは 王様だ 裸の 王様だ みんなの 王様だ
5,童謡賞,8569,おもちゃのチャチャチャ_by_真理ヨシコ,おもちゃの チャチャチャ おもちゃの チャチャチャ チャチャチャ おもちゃのチャチャチャ そらに きらきら おほしさま みんな すやすや ねむるころ おもちゃは はこを とびだして おどる おもちゃの チャチャチャ おもちゃの チャチャチャ おもちゃの チャチャチャ チャチャチャ おもちゃのチャチャチャ なまりのへいたい とてちてた らっぱ ならして こんばんは フランスにんぎょう すてきでしょ はなのドレスで チャチャチャ おもちゃの チャチャチャ おもちゃの チャチャチャ チャチャチャ おもちゃのチャチャチャ とんぼ みたいな ヘリコプター ぐんと はやいな ジェットきは サイレン なれば はっしゃです うちゅう ロケット チャチャチャ おもちゃの チャチャチャ おもちゃの チャチャチャ チャチャチャ おもちゃのチャチャチャ きょうは おもちゃの おまつりだ みんな たのしく うたいましょ ブタは ブースカ こねこはニャー あまちゃのみのみ チャチャチャ おもちゃの チャチャチャ おもちゃの チャチャチャ チャチャチャ おもちゃのチャチャチャ そらに さよなら おほしさま まどに おひさま こんにちは おもちゃは かえる おもちゃばこ そして ねむるよ チャチャチャ おもちゃの チャチャチャ おもちゃの チャチャチャ チャチャチャ おもちゃのチャチャチャ おもちゃの チャチャチャ おもちゃの チャチャチャ チャチャチャ おもちゃのチャチャチャ
5,新人賞,43573,学園広場_by_舟木一夫,空にむかって あげた手に 若さがいっぱい とんでいた 学園広場で 肩くみあって 友と うたった 若い歌 涙ながした 友もある 愉快にさわいだ 時もある 学園広場に 咲いてる花の ひとつ ひとつが 想いでさ ぼくが卒業 してからも 忘れはしないよ いつまでも 学園広場は 青春広場 夢と 希望が ある広場
5,新人賞,13873,高校三年生_by_舟木一夫,赤い夕陽が 校舎をそめて ニレの木蔭に 弾む声 ああ 高校三年生 ぼくら 離れ離れに なろうとも クラス仲間は いつまでも 泣いた日もある 怨んだことも 思い出すだろ なつかしく ああ 高校三年生 ぼくら フォークダンスの 手をとれば 甘く匂うよ 黒髪が 残り少ない 日数を胸に 夢がはばたく 遠い空 ああ 高校三年生 ぼくら 道はそれぞれ 別れても 越えて歌おう この歌を
5,新人賞,42640,島のブルース_by_三沢あけみ・和田弘とマヒナスターズ,奄美なちかしや 蘇鉄(ソテツ)のかげで 泣けばゆれます サネン花ョ ながい黒髪 島むすめ島むすめョ 愛人(カナ)はいまごろ 起きてか寝てか 淋しがらせる 浜千鳥ョ 南風(ハエ)のふく夜は ねむられぬねむられぬョ 夏のおどりは 七日と七夜 みんな知り候(ショ)る 月の夜ョ 名瀬の港の 船がでる船がでるョ 着せてみせたい 大島つむぎ わすれられない あのひとにョ なさけひとすじ 島むすめ島むすめョ
5,新人賞,No ID!,私も流れの渡り鳥_by_三沢あけみ,赤く咲いても淋しやこころ熱い吐息のやるせなさ星が流れる島空夜空ながれながれて何処へゆくああ私も流れの渡り鳥みんな夢よと口には言えどなんでこのまま忘らりょかあなた一人に身も世も捨てて今じゃ悲しい片羽鳥ああ旅路を流れの渡り鳥あれは千鳥かいとしゅてならぬ誰を慕うてちよちよと泣きなお泣きな涙に濡れてつばさ重たくならぬほどああ私も流れの渡り鳥
6,大賞,13082,愛と死をみつめて_by_青山和子,まこ… 甘えてばかりで ごめんネ みこは… とっても倖わせなの はかない いのちと しった日に 意地悪いって 泣いたとき 涙をふいて くれた…まこ まこ… わがまゝいって ごめんネ みこは… ほんとにうれしかったの たとえその瞳は 見えずとも ふたりでゆめみた 信濃路を せおって歩くと いった…まこ まこ… げんきになれずに ごめんネ みこは… もっと 生きたかったの たとえこの身は 召されても 二人の愛は 永遠に咲く みこのいのちを いきて…まこ
6,歌唱賞,4726,夜明けのうた_by_岸洋子,夜明けのうたよ 私の心の 昨日の悲しみ 流しておくれ 夜明けのうたよ 私の心に 若い力を 満たしておくれ 夜明けのうたよ 私の心の あふれる想いを わかっておくれ 夜明けのうたよ 私の心に 大きな望みを だかせておくれ 夜明けのうたよ 私の心の 小さな幸福 守っておくれ 夜明けのうたよ 私の心に 想い出させる ふるさとの空
6,童謡賞,No ID!,ワンツースリーゴー_by_音羽ゆりかご会,自動車いっぱい 人いっぱい ほらほら ご注意 横断歩道 右見てワン 左をツー もいちど右見てスリー 仲よくゴー ワン ツー スリー ゴー ワンツースリーゴー  いそいじゃいけない あぶないよ ほらほら横丁も 大きな道も 右見てワン 左をツー もいちど右見てスリー 仲よくゴー ワン ツー スリー ゴー ワンツースリーゴー  交通信号 守りましょう ほらほらそろって 横断歩道 右見てワン 左をツー もいちど右見てスリー 仲よくゴー ワン ツー スリー ゴー ワンツースリーゴー
6,新人賞,42733,君だけを_by_西郷輝彦,いつでも いつでも 君だけを 夢に見ている ぼくなんだ 星の光を うつしてる 黒い瞳に 出合うたび 胸がふるえる ぼくなんだ いつでも いつでも 君だけが 待っていそうな 街の角 そんな気持に させるのは 君の素敵な 黒い髪 雨に濡れてた 長い髪 いつでも いつでも 君だけと 歩きたいのさ 夜の道 ふたつ並んだ あの星も いつも仲良く ひかってる 君と僕との そのように
6,新人賞,41829,十七才のこの胸に_by_西郷輝彦,風に吹かれた 花びらを うかべて波は 遠ざかる ひとりぼっちの 湖は 口笛さえも 切れ切れに 山むらさきに 夜がくる 空をまっかに そめながら どこ行く夕日 ひとり旅 そっとよぼうか 思い出を 十七才の この胸に しまっておいた 思い出を 夜がしずかに 訪れりゃ 湖さみし 風さみし ひとりぼっちの ぼくだから あてなくたどる 落葉松(からまつ)の 林の道を ただひとり
6,新人賞,13875,アンコ椿は恋の花_by_都はるみ,三日おくれの 便りをのせて 船が行く行く 波浮港 いくら好きでも あなたは遠い 波の彼方へ 去ったきり あんこ便りは あんこ便りは あゝ 片便り 三原山から 吹き出す煙 北へなびけば 思い出す 惚れちゃならない 都の人に よせる思いが 灯ともえて あんこ椿は あんこ椿は あゝ すゝりなき 風にひらひら かすりの裾が 舞えばはずかし 十六の 長い黒髪 プッツリ切って かえるカモメに たくしたや あんこつぼみは あんこつぼみは あゝ 恋の花
7,大賞,13083,柔_by_美空ひばり,勝つと思うな 思えば負けよ 負けてもともと この胸の 奥に生きてる 柔の夢が 一生一度を 一生一度を 待っている 人は人なり のぞみもあるが 捨てゝ立つ瀬を 越えもする せめて今宵は 人間らしく 恋の涙を 恋の涙を 噛みしめる 口で言うより 手の方が早い 馬鹿を相手の 時じゃない 行くも住(とま)るも 坐(すわ)るも臥(ふ)すも 柔一すじ 柔一すじ 夜が明ける
7,歌唱賞,21643,ワン・レイニー・ナイト・イン・トーキョー_by_越路吹雪,小雨降る夜は なぜか淋しくて しんみりあなたと お話したいの なんにも云わずに 別れたあの夜 つれない方と うらんでますのよ ワン・レイニー・ナイト・イン・トーキョー やるせない雨よ 小窓うつ音は 雨のささやきか しみじみあなたを 想い出してるの あなたがいるなら なんにもいらない せめてもう一度 云わせてアイ・ラブ・ユー ワン・レイニー・ナイト・イン・トーキョー やるせない雨よ
7,童謡賞,13922,マーチングマーチ_by_童謡・唱歌,マーチったら チッタカタア こうしんだ マーチったら チッタカタア こうしんだ みぎあしくん ひだりあしくん かわり ばんこ かわり ばんこ ぼくを はこんで チッタカ タッタッタア のっぱらへ つれていけ チッタカ タッタッタア マーチったら チッタカタア こうしんだ マーチったら チッタカタア こうしんだ バスみちくん どろみちくん ざっくざっく ぼっこぼっこ ざっくざっく ぼっこぼっこ いいおと ならして チッタカ タッタッタア のっぱらへ つれていけ チッタカ タッタッタア かか かえるの おへそ みみ みみずの めだま あるのか ないのか ないのか あるのか みにゆこう マーチったら チッタカタア こうしんだ マーチったら チッタカタア こうしんだ ふるぐつくん ぼろぐつくん ひだりみぎ ひだりみぎ 12 34 ぼくを はこんで チッタカ タッタッタア のっぱらへ つれていけ チッタカ タッタッタア
7,新人賞,13877,女心の唄_by_バーブ佐竹,あなただけはと 信じつつ 恋におぼれて しまったの 心変わりが せつなくて つのる思いの しのび泣き どうせ私を だますなら だまし続けて ほしかった 酔っている夜は 痛まぬが さめてなおます 胸の傷 うわべばかりと つい知らず ほれてすがった 薄情け 酒がいわせた ことばだと なんでいまさら 逃げるのよ 女ですもの 人並みに 夢を見たのが なぜ悪い 今夜しみじみ 知らされた 男心の うらおもて 逃げた人なぞ 追うものか 追えばなおさら つらくなる 遠いあの夜の 思い出を そっと抱くたび ついほろり 散って砕けた 夢の数 つなぎあわせて 生きてゆく いつか来る春 幸福(しあわせ)を のぞみすてずに ひとり待つ
7,新人賞,36,愛して愛して愛しちゃったのよ_by_和田弘とマヒナスターズ＆田代美代子,愛しちゃったのよ 愛しちゃったのよ あなただけを 死ぬ程に 愛しちゃったのよ 愛しちゃったのよ ねてもさめても たゞあなただけ 生きているのが つらくなるような長い夜 こんな気持ちは 誰もわかっちゃくれない 愛しちゃったのよ 愛しちゃったのよ あなただけを 生命をかけて いつからこんなに いつからこんなに あなたを好きに なったのか どうしてこんなに どうしてこんなに あなたの為に 苦しいのかしら もしもあなたが 居なくなったらどうしよう 私一人じゃ とても生きちゃいけない 愛しちゃったのよ 愛しちゃったのよ あなただけを 生命をかけて 生命をかけて 生命をかけて
8,大賞,13084,霧氷_by_橋幸夫,霧氷…… 霧氷…… 思い出は かえらない 遥かな 遥かな 冬空に 消えた恋 霧の街角で 告げたさよならが 僕を 僕を 僕を泣かす 霧氷…… 霧氷…… なにもかも 夢だった 今でも 今でも 愛しては いるけれど どこにいるさえ 今は知らぬ人 僕を 僕を 僕を泣かす 霧氷…… 霧氷…… 美しい 恋だった 消えない 消えない 悲しみを 胸にだき 霧の街角を 一人今日もゆく 僕を 僕を 僕を泣かす
8,歌唱賞,43596,絶唱_by_舟木一夫,愛おしい 山鳩は 山こえて どこの空 名さえはかない 淡雪の娘よ なぜ死んだ ああ 小雪 結ばれて 引き裂かれ 七年を 西東 いのち短く 待つ日は永く 泣きぬれた ああ 小雪 山番の 山小舎に 春が来る 花が咲く 着せて空しい 花嫁衣裳 とこしえの ああ 小雪 なぜ死んだ ああ 小雪
