回数,賞,ID,song_by,歌詞
23,金賞,2737,ス・ト・リ・ッ・パー_by_沢田研二,ヒールを脱ぎ捨て ルージュを脱ぎ捨て すべてを脱ぎ捨てたら おいで 裸にならなきゃ 始まらない ショーの始まりさ…… 過去を脱ぎ捨て 昨日を脱ぎ捨て すべてを脱ぎ捨てたら おいで 瞳を隠して 逃げ込むなら 話にならないぜ 朝でも夜でも 真昼でも 恋はストリッパー 裸の触れあい 春でも 秋でも 真冬でも 愛はストリッパー 見せるが勝ちだぜ オレのすべてを 見せてやる オマエのすべてを 見たい 嘘を脱ぎ捨て 罪を脱ぎ捨て すべてを脱ぎ捨てたらおいで 男と女はアダムとイブ 可愛いいものだよ 未来を脱ぎ捨て 明日を脱ぎ捨て すべてを脱ぎ捨てたらおいで 弱いとこも見せちまえば 綺麗に変われる 朝でも夜でも 真昼でも 恋はストリッパー 人生のステージ 春でも 秋でも 真冬でも 愛はストリツパー 幕は上がってる オレのすべてを 見せてやる オマエのすべてを 見たい オレのすべてを 見せてやる オマエのすべてを 見たい
23,金賞,94237,センチメンタル・ガール_by_西城秀樹,枯葉舞う 公園に たたずんで 何を想うの またひとつ 大人になった またすこし きれいになった 今すぐに かけてこい ためらわず 僕の胸に 秋風に ふるえてないで いつでも そばにいるのに 君よ悲しみを ふきとばし 夢に見たような 燃える恋をしよう 抱きしめて 二度と はなさない 夢だけは いつまでも なくさずに いればいいのさ それでも さみしい季節 君には 僕が必要さ 君よ風の中 フタリ歩いて行こう 夢をつかむため 君よ倖せは この僕が すべて あげるから 君よ悲しみを ふきとばし 夢に見たような 燃える恋をしよう 抱きしめて 二度と はなさない 君よ風の中 フタリ歩いて行こう 夢をつかむため 君よ倖せは この僕が すべて あげるから 君よ悲しみを ふきとばし 夢に見たような 燃える恋をしよう 抱きしめて 二度と はなさない
23,金賞,4248,街角トワイライト_by_シャネルズ,"Hold me tight, Hold me tight, My little girl 琥珀色をした 首筋に 俺のイニシャルの ペンダント 愛してる 愛してる ささやいた lovely girl 夕闇迫る 街角で お前に良く似た プロフィール 追いかけて 追いかけて 今でも Searchin' only you 南風 受けながら 生まれたままの姿で 愛し合い 夜明けまで Night on the beach Hold me tight, Hold me tight, My little girl 迫りくる愛の 激しさを  ふたりの体で 受け止めて 夏が過ぎ 木枯らしに 暮しは冷え始め And she had gone 南風 受けながら 生まれたままの姿で 愛し合い 夜明けまで Night on the beach Hold me tight, Hold me tight, My little girl 夕闇迫る 街角で お前に良く似た プロフィール 追いかけて 追いかけて 今でも Searchin' only you But she had gone"
23,金賞,4537,もしもピアノが弾けたなら_by_西田敏行,もしも ピアノが弾けたなら 思いのすべてを歌にして きみに 伝えることだろう 雨が降る日は雨のように 風吹く夜には風のように 晴れた朝には晴れやかに だけど ぼくにはピアノがない きみに聴かせる腕もない 心はいつでも半開き 伝える言葉が残される アア アー アア… 残される もしも ピアノが弾けたなら 小さな灯りを一つつけ きみに 聴かせることだろう 人を愛したよろこびや 心が通わぬ悲しみや おさえきれない情熱や だけど ぼくにはピアノがない きみと夢みることもない 心はいつでも空(から)まわり 聴かせる夢さえ遠ざかる アア アー アア… 遠ざかる
23,ロング・セラー賞,4011,ブランデーグラス_by_石原裕次郎,これでおよしよ そんなに強くないのに 酔えば酔うほど 淋しくなってしまう 涙ぐんで そっと時計をかくした 女ごころ 痛いほどわかる 指で包んだ まるいグラスの底にも 残り少ない 夢がゆれている よせばよかった よせばよかったけれど 恋は知らずに 炎えてしまうものだよ 白い小指 ためらいながらからませ 未練ごころ 打ちあけたおまえ 雨はふるふる 部屋の中にも胸にも いつか来そうな 別離(わかれ)を告げて こころひとつ 傘はふたつにはなれて 逢えば夜は つかの間に過ぎる 雨はふるふる 遠く消えてく背中と いつか来そうな 別離を濡らす
23,ロング・セラー賞,4347,みちのくひとり旅_by_山本譲二,ここでいっしょに 死ねたらいいと すがる涙の いじらしさ その場しのぎの なぐさめ云って みちのく ひとり旅 うしろ髪ひく かなしい声を 背(せな)でたちきる 道しるべ 生きていたなら いつかは逢える 夢でも逢えるだろう 時の流れに 逆らいながら ひとりゆく身の 胸のうち 俺は男と つぶやきながら みちのく ひとり旅 月の松島 しぐれの白河 昨日と明日は ちがうけど 遠くなるほど いとしさつのる みれんがつのるだけ たとえどんなに 恨んでいても たとえどんなに 灯りがほしくても お前が俺には 最後の女 俺にはお前が 最後の女 たとえどんなに つめたく別れても お前が俺には 最後の女 たとえどんなに 流れていても お前が俺には 最後の女
23,ロング・セラー賞,958,奥飛騨慕情_by_竜鉄也,風の噂さに 一人来て 湯の香恋しい 奥飛騨路 水の流れも そのままに 君はいでゆの ネオン花 あゝ 奥飛騨に 雨がふる 情けの淵に 咲いたとて 運命悲しい 流れ花 未練残した 盃に 面影揺れて また浮ぶ あゝ 奥飛騨に 雨がふる 抱いたのぞみの はかなさを 知るや谷間の 白百合よ 泣いてまた呼ぶ 雷鳥の 声もかなしく 消えてゆく あゝ 奥飛騨に 雨がふる
24,大賞,1486,北酒場_by_細川たかし,北の酒場通りには 長い髪の女が似合う ちょっとお人よしがいい くどかれ上手な方がいい 今夜の恋は煙草の先に 火をつけてくれた人 からめた指が運命(さだめ)のように 心を許す 北の酒場通りには 女を酔わせる恋がある 北の酒場通りには 涙もろい男が似合う ちょっと女好きがいい 瞳でくどける方がいい 夢追い人はグラスの酒と 思い出を飲みほして やぶれた恋の数だけ人に やさしくできる 北の酒場通りには 男を泣かせる歌がある 今夜の恋は煙草の先に 火をつけてくれた人 からめた指が運命のように 心を許す 北の酒場通りには 女を酔わせる恋がある
24,金賞,1486,北酒場_by_細川たかし,北の酒場通りには 長い髪の女が似合う ちょっとお人よしがいい くどかれ上手な方がいい 今夜の恋は煙草の先に 火をつけてくれた人 からめた指が運命(さだめ)のように 心を許す 北の酒場通りには 女を酔わせる恋がある 北の酒場通りには 涙もろい男が似合う ちょっと女好きがいい 瞳でくどける方がいい 夢追い人はグラスの酒と 思い出を飲みほして やぶれた恋の数だけ人に やさしくできる 北の酒場通りには 男を泣かせる歌がある 今夜の恋は煙草の先に 火をつけてくれた人 からめた指が運命のように 心を許す 北の酒場通りには 女を酔わせる恋がある
24,新人賞,4720,ゆ・れ・て湘南_by_石川秀美,サヨナラって夏の海に 夕陽が言う 淋しさの背中に頬寄せて きれいな涙が歌うよに 海を見てたね My Little Girl 時はいつも急ぎ足で 過ぎてゆくよ 君だって大人の顔をして 忘れてしまうよ ボクたちの 短い真夏を My Little Girl ゆれて 海岸ロード 走る バックミラーに 映る江ノ島さ Please Please Me ゆれて ゆれて湘南 君は最後まで優しさを 忘れなかったね サーフボード抱えながら 人が渡る 重そうな青春抱きしめて 愛して疲れたボクたちの 横顔みたいさ My Little Girl ゆれて 海岸ロード ひとり レモネード飲む 君が好きだった Hold Your Hand ゆれて ゆれて湘南 ひびく波のララバイ そして夏に背を向けて ゆれて 海岸ロード 走る バックミラーに 映る江ノ島さ Please Please Me ゆれて ゆれて湘南 君は最後まで優しさを 忘れなかったね
24,新人賞,3865,100％…SOかもね！_by_シブがき隊,"かもね かもね 恋かもね ピタリ あっちゃう かもね かもね かもね そうかもね くせに なっちゃう かもね Baby, Burn！ Burn！ Burn！ 今夜 決めなきゃ Baby, Burn！ Burn！ Burn！ ただの友達 いつも 夢みていたよ もし 君と キッスできたら 俺 街中を 逆立ちしたまま Love Love I Love you 叫んでも いいぜ ミニの赤いスカートが ドキリと まぶしくて あわてながら 微笑んで サングラスをかけた Baby, Stop！ Stop！ Stop！ あせるぜ ほんと Baby, Stop！ Stop！ Stop！ 事件さ これは 危ない ラブ・モーション かもね かもね 恋かもね ピタリ あっちゃう かもね かもね かもね そうかもね くせに なっちゃう かもね Baby, Burn！ Burn！ Burn！ 今夜 決めなきゃ Baby, Burn！ Burn！ Burn！ ただの友達 君は 気づいちゃいないけど 胸の あいてるシャツは もう ちゃんとした 誘惑なんだぜ Love Love I Love you 我慢できないよ 「終電車がでちゃった」と すぼめた唇が どこか 妙にセクシーで グラスを倒したよ Baby, Stop！ Stop！ Stop！ まずいぜ ほんと Baby, Stop！ Stop！ Stop！ 恋だぜ これは 危ない ラブ・モーション"
24,最優秀新人賞,3865,100％…SOかもね！_by_シブがき隊,"かもね かもね 恋かもね ピタリ あっちゃう かもね かもね かもね そうかもね くせに なっちゃう かもね Baby, Burn！ Burn！ Burn！ 今夜 決めなきゃ Baby, Burn！ Burn！ Burn！ ただの友達 いつも 夢みていたよ もし 君と キッスできたら 俺 街中を 逆立ちしたまま Love Love I Love you 叫んでも いいぜ ミニの赤いスカートが ドキリと まぶしくて あわてながら 微笑んで サングラスをかけた Baby, Stop！ Stop！ Stop！ あせるぜ ほんと Baby, Stop！ Stop！ Stop！ 事件さ これは 危ない ラブ・モーション かもね かもね 恋かもね ピタリ あっちゃう かもね かもね かもね そうかもね くせに なっちゃう かもね Baby, Burn！ Burn！ Burn！ 今夜 決めなきゃ Baby, Burn！ Burn！ Burn！ ただの友達 君は 気づいちゃいないけど 胸の あいてるシャツは もう ちゃんとした 誘惑なんだぜ Love Love I Love you 我慢できないよ 「終電車がでちゃった」と すぼめた唇が どこか 妙にセクシーで グラスを倒したよ Baby, Stop！ Stop！ Stop！ まずいぜ ほんと Baby, Stop！ Stop！ Stop！ 恋だぜ これは 危ない ラブ・モーション"
24,新人賞,151691,アンサーソングは哀愁_by_早見優,無邪気な顔の微笑みを 仲間のうちで見せながら 一人になると心がうずく毎日 鏡の中で大人びて ルージュを薄くぬりながら おさない愛のあれこれ想う真夜中 奪われる 奪えない 奪うもの 奪え 奪ってよ 奪わせて 私を あなたを 愛の歌を送りつづけて一年 アンサーソングは いつも いつも いつも 哀愁 All our precious memories have finally come to an end But I'll always remember you 真赤なバイク走らせて 想い出残る海に来て 三角波の季節に涙ながした ガラスのような夏の陽が 二人をいつもつつんでた 素肌を寄せたあの日も遠い出来事 抱(いだ)かれる 抱けない 抱くもの 抱け 抱いてよ 抱かせて 私をあなたを 愛の歌を送りつづけて一年 アンサーソングは いつも いつも いつも 哀愁 奪われる 奪えない 奪うもの 奪え 奪ってよ 奪わせて 私をあなたを 愛の歌を送りつづけて一年 アンサーソングは いつも いつも いつも 哀愁
24,新人賞,5754,待ちぼうけ_by_堀ちえみ,ディズニー・ウォッチのぞく 瞳はくもりがちで 40分もここで あなたを待っているの 早く来てね ああ 心細くなりそうよ お茶はいかがなんて 誰かに声かけられて 涙ひとつぶ こぼれて落ちた もう あなたなんか 嫌い 真っ青な顔をして 駆けつけた時はもう アンブレラを残して 家に帰ってるはず 雨に濡れた おろしたてのワンピースも あなただけに 見せてあげたかったのに なんて悲しい 日曜日なの もう あなたなんか 嫌い だけど 気になるの ふられたのかなって 誰か 好きな人 見つけたのかなって 私 少し あわて過ぎてたみたいね 時計の針 2時間すすんでたこと 今 気づいたの ごめんなさいね あなた きっと 待ちぼうけ あなた きっと 待ちぼうけ
24,新人賞,2838,センチメンタル・ジャーニー_by_松本伊代,読み捨てられる 雑誌のように 私のページが めくれるたびに 放り出されて しまうのかしら それが知りたくて とても あなたの瞳の奥に旅してく わたしなの センチメンタル・ジャーニー つぼみのままで 夢を見ていたい 影絵のように美しい 物語だけ見てたいわ 伊代はまだ 16だから 何かにさそわれて あなたに さらわれて センチメンタル・ジャーニー 見知らぬ国の 謎の湖 のぞき見たくなる 不思議な気持 自分でさえも こわいほどなの 咲かせた恋なら ずっと 大事にしていて貰えるのかしら わからないセンチメンタル・ジャーニー 扉の前で ためらいながらも 背中をそっと押されたい 見ないふりして 許してね 伊代はまだ 16だから 何かにさそわれて あなたに さらわれて 何かにさそわれて あなたに さらわれて センチメンタル・ジャーニー
24,最優秀歌唱賞,2595,シルエット・ロマンス_by_大橋純子,恋する女は夢見たがりの いつもヒロイン つかの間の 鏡に向かってアイペンシルの 色を並べて迷うだけ 窓辺の憂い顔は装う女心 茜色のシルエット ああ あなたに恋心ぬすまれて もっとロマンス 私に仕掛けてきて ああ あなたに恋模様染められて もっとロマンス ときめきを止めないで あなたのくちびる 首すじかすめ 私の声もかすれてた 無意識にイヤリング 気づいたらはずしてた 重なりあう シルエット ああ 抱きしめて 身動き出来ないほど もっとロマンス 甘くだましてほしい ああ 抱きしめて 鼓動がひびくほどに もっとロマンス 激しく感じさせて ああ あなたに恋心ぬすまれて もっとロマンス 私に仕掛けてきて ああ あなたに恋模様染められて もっとロマンス ときめきを止めないで
24,金賞,872,越前岬_by_川中美幸,きこえるはずない 汽笛を聴いて 飲めば泣きそな ひとり酒 ついてゆきたい ついてゆけない 燃やす切符の 残り火が あなた消えます あなた消えます 越前岬 しあわせ欲しがる 女の夢が いつかあなたを 駄目にする これでいいのね 悔いはないのね 遠くなるほど 逢いたくて あなた恋しい あなた恋しい 越前岬 おまえの明日は ふたりの明日 そんなあの夜の 腕まくら 忘れたいのに 忘れられない ひとり紅ひく とまり木で 春を待ちます 春を待ちます 越前岬
24,金賞,42827,花梨_by_柏原芳恵,幼なじみの貴方に恋を 感じはじめていたのかしら 貴方は明日東京に越して行ってしまう “僕は必ず手紙を書く”と 貴方は笑顔で手を振った ひとつぐらい小説みたいな恋もしたい 花梨 花梨 実らぬ恋 季節が過ぎてもただ香るだけ 花梨 花梨 いつになれば 白い薔薇になれるのかしら カリン カリン オモイデノ カリン カリンノハナ お元気ですか 手紙がとだえ あれから一年がたちます 私はもうボーイフレンドも作りました 元気でいると手紙下さい ただ一言だけでいいから 朝のポスト 胸が痛みます 今も今も 花梨 花梨 実らぬ恋 つよがりも 嘘にも疲れました 花梨 花梨 いつになれば 白い薔薇になれるのかしら 花梨 花梨 実らぬ恋 季節が過ぎてもただ香るだけ 花梨 花梨 いつになれば 白い薔薇になれるのかしら カリン カリン オモイデノ カリン カリンノハナ
24,金賞,1766,けんかをやめて_by_河合奈保子,けんかをやめて 二人をとめて 私のために争わないで もうこれ以上 ちがうタイプの人を 好きになってしまう 揺れる乙女心 よくあるでしょう だけどどちらとも 少し距離を置いて うまくやってゆける 自信があったの ごめんなさいね 私のせいよ 二人の心 もてあそんで ちょっぴり 楽しんでたの 思わせぶりな態度で…… だから けんかをやめて 二人を止めて 私のために争わないで もうこれ以上 ボーイフレンドの数 競う仲間達に 自慢したかったの ただそれだけなの いつか本当の愛 わかる日が来るまで そっとしておいてね 大人になるから ごめんなさいね 私のせいよ 二人の心 もてあそんで ちょっぴり 楽しんでたの 思わせぶりな態度で…… だから けんかをやめて 二人をとめて 私のために争わないで もうこれ以上
24,金賞,1965,小麦色のマーメイド_by_松田聖子,涼しげなデッキ・チェアー ひとくちの林檎酒 プールに飛び込むあなた 小指で投げ KISS WINK WINK WINK 常夏色の夢 追いかけて あなたをつかまえて泳ぐの わたし裸足のマーメイド 小麦色なの 灼けた素肌にキラキラ 冷たい水しぶき ひどいわまどろむわたし しっかり狙ったの WINK WINK WINK すねて怒る君も 可愛いよ 急にまじめ顔でつぶやく 嫌い あなたが大好きなの 嘘よ 本気よ 常夏色の風 追いかけて あなたをつかまえて生きるの わたし裸足のマーメイド 小麦色なの 好きよ 嫌いよ
24,金賞,2788,聖・少女_by_西城秀樹,八月の波を水鏡にして お前はルージュを海に投げるのさ 最後のタバコに火をつけてくれよ 海猫みたいに淋しい瞳で とまどいランデブー 時計の針で傷つけあえばなお悲しいぜ Say it 少女 愛しているわと Say it 少女 振りむいてくれよ 空も海も夏のエメラルド お前の気持が読みきれないよ 夏色の雲がとばりをあげれば 濡れたTシャツに若さが透けるよ 1人が好きよと 強がってみても 投げやりな涙かくしきれないさ とまどいランデブー 生き方までも変えちまうほど 危険な香り Say it 少女 お前の身体を Say it 少女 軽く抱き上げて 何処へ何処へ流れてゆこうか お前の気持が読みきれないよ 読みきれないよ Say it 少女 愛しているわと Say it 少女 振りむいてくれよ 空も海も夏のエメラルド お前の気持が読みきれないよ お前の気持が読みきれないよ 読みきれないよ Say it 少女 愛しているわと Say it 少女 振りむいてくれよ Say it 少女 お前の身体を Say it 少女 軽く抱き上げて
24,金賞,3046,契り_by_五木ひろし,あなたは誰と契りますか 永遠の心を結びますか 波のうねりが岸にとどく 過去の歌をのせて 激しい想いが砕ける 涙のように 緑は今もみずみずしいか 乙女はあでやかか 人の心は鴎のように 真白だろうか 愛するひとよ 美しく 愛するひとよ すこやかに 朝の光が海を染める 生きる夢に満ちて まぶしい願いがきらめく いのちのように 流れは今も清らかだろうか 子供はほがらかか 人はいつでも桜のように 微笑むだろうか 愛するひとよ 美しく 愛するひとよ すこやかに 愛するひとよ 美しく 愛するひとよ すこやかに
24,金賞,3416,夏をあきらめて_by_研ナオコ,波音が響けば 雨雲が近づく 二人で思いきり 遊ぶはずの on the beach きっと誰かが 恋に破れ 噂のタネに 邪魔する 君の身体も 濡れたまま 乾く間もなくて 胸元が揺れたら しずくが砂に舞い 言葉も無いままに あきらめの夏 Darlin' Can't You See? I'll Try To Make It Shine Darlin' Be With Me! Let's Get To Be So Fine 潮風が騒げば やがて雨の合図 悔やしげな 彼女とかけこむ Pacific Hotel うらめしげに ガラスごしに 背中で見てる 渚よ 腰のあたりまで 切れ込む 水着も見れない 熱めのお茶を飲み 意味シンなシャワーで 恋人も泣いてる あきらめの夏 Darlin' Can't You See? I'll Try To Make It Shine Darlin' Be With Me! Let's Get To Be So Fine 岩影にまぼろしが 見えりゃ虹が出る 江の島が遠くに ボンヤリ寝てる このまま君と あきらめの夏
24,金賞,4639,誘惑スレスレ_by_田原俊彦,男は顔じゃないよ ハートさ 女も顔じゃないよ ノリだよ さァ一丁手を打ちゃ 決まりさ 真剣なオレ やったぜよろしく バラの花を胸に飾る イカしたギャングが あいつも こいつも おまえを狙うよ シャンパン越し あわに浮ぶ はずんだ瞳に ため息を くり返す 誘惑スレスレみたいさ 愛しているのさ 好きだよ 抱いて抱きたい うそじゃない 本当のハートさ 愛に泣く 男の ノリだよ おまえはセクシーなハートのエースさ Oh Darlin' やったぜ よろしく 昨日もlonely 明日もlonelyじゃかっこがつかない 毎日が壁の花浮かない Every DAY 待っていたよ おまえの来る土曜のディスコティック ときめきがせつなくて パニックスレスレみたいさ 「愛しているのさ 好きだよ」 素直に言い出せなくて うそじゃない 本当のハートさ 愛に泣く 男の ノリだよ おまえはセクシーなハートのエースさ Oh Darlin' やったぜ よろしく 男は顔じゃないよ ハートさ 女も顔じゃないよ ノリだよ さァ一丁手を打ちゃ 決まりさ 真剣なオレ やったぜよろしく
24,金賞,4887,6番目のユ・ウ・ウ・ツ_by_沢田研二,泣きたい時には いつも 聖母(マドンナ)のほほえみで…ほら レースのハンカチーフ 僕に差し出すよ できすぎた恋人さ 僕のくちびるについた ルージュをぬぐわないで…くれ 誰もがあなたと 暮らす夢 見るけど… 一人で歩かせてくれ 愛があふれすぎているよ この部屋は暖かすぎる まるで…safety zone 毎日 僕 眠れない やるせない 毎日 僕 生きてない 愛せない あなたを抱いても だれかを抱いても ユ・ウ・ウ・ツだよ… あなたには ガラスの靴が 僕には 氷の靴が…合う 果てしない夢を… 追いかけてゆきたい 今よりはきっとましさ もっと 血を流してみたい 見知らぬナイフに 傷つけば そこは misty zone 毎日 僕 眠れない やるせない 毎日 僕 生きてない 愛せない あなたを抱いても だれかを抱いても ユ・ウ・ウ・ツだよ… 毎日 僕 眠れない やるせない 毎日 僕 生きてない 愛せない あなたを抱いても だれかを抱いても ユ・ウ・ウ・ツだよ…
24,ロングセラー賞,4111,望郷酒場_by_千昌夫,おやじみたいなヨー 酒呑みなどに ならぬつもりが なっていた 酔えば恋しい 牛追い唄が 口に出るのさ こんな夜は ハーヤイ 田舎なれどもサー 南部の国はヨー 風にちぎれてヨー のれんの裾を 汽車がひと泣き 北へ行く 呼べばせつない あの娘の面影(かお)が 酒のむこうに 揺れるのさ ハーヤイ 酒に溺れてヨー やつれてやせた 故里(くに)へ土産の 夢ひとつ 北はみぞれか しぐれる頃か やけにおふくろ 気にかかる ハーヤイ
24,ロングセラー賞,4467,夫婦舟_by_三笠優子,この川がどこへ流れてゆこうとも 岸を離れた夫婦舟 愛しあう…… ふたりに嵐が吹こうとも 一緒に生きてく あなたがいるわ 浮草に似てもいいのよかまわない 夢が積荷の夫婦舟 ふるさとに…… 戻れるその日がなくっても 涙をふき合う あなたがいるわ 幸せをつなぐどこかに橋がある そこへ着きたい夫婦舟 この人の…… 明日に私の明日がある 一緒に生きてく あなたがいるわ
